{
 "abi": [
  {
   "inputs": [
    {
     "internalType": "string",
     "name": "_name",
     "type": "string"
    },
    {
     "internalType": "string",
     "name": "_symbol",
     "type": "string"
    },
    {
     "internalType": "uint8",
     "name": "_decimals",
     "type": "uint8"
    }
   ],
   "stateMutability": "nonpayable",
   "type": "constructor"
  },
  {
   "inputs": [],
   "name": "DOMAIN_SEPARATOR",
   "outputs": [
    {
     "internalType": "bytes32",
     "name": "",
     "type": "bytes32"
    }
   ],
   "stateMutability": "view",
   "type": "function"
  },
  {
   "inputs": [
    {
     "internalType": "address",
     "name": "",
     "type": "address"
    },
    {
     "internalType": "address",
     "name": "",
     "type": "address"
    }
   ],
   "name": "allowance",
   "outputs": [
    {
     "internalType": "uint256",
     "name": "",
     "type": "uint256"
    }
   ],
   "stateMutability": "view",
   "type": "function"
  },
  {
   "inputs": [
    {
     "internalType": "address",
     "name": "spender",
     "type": "address"
    },
    {
     "internalType": "uint256",
     "name": "amount",
     "type": "uint256"
    }
   ],
   "name": "approve",
   "outputs": [
    {
     "internalType": "bool",
     "name": "",
     "type": "bool"
    }
   ],
   "stateMutability": "nonpayable",
   "type": "function"
  },
  {
   "inputs": [
    {
     "internalType": "address",
     "name": "",
     "type": "address"
    }
   ],
   "name": "balanceOf",
   "outputs": [
    {
     "internalType": "uint256",
     "name": "",
     "type": "uint256"
    }
   ],
   "stateMutability": "view",
   "type": "function"
  },
  {
   "inputs": [
    {
     "internalType": "address",
     "name": "from",
     "type": "address"
    },
    {
     "internalType": "uint256",
     "name": "value",
     "type": "uint256"
    }
   ],
   "name": "burn",
   "outputs": [],
   "stateMutability": "nonpayable",
   "type": "function"
  },
  {
   "inputs": [],
   "name": "decimals",
   "outputs": [
    {
     "internalType": "uint8",
     "name": "",
     "type": "uint8"
    }
   ],
   "stateMutability": "view",
   "type": "function"
  },
  {
   "inputs": [
    {
     "internalType": "address",
     "name": "to",
     "type": "address"
    },
    {
     "internalType": "uint256",
     "name": "value",
     "type": "uint256"
    }
   ],
   "name": "mint",
   "outputs": [],
   "stateMutability": "nonpayable",
   "type": "function"
  },
  {
   "inputs": [],
   "name": "name",
   "outputs": [
    {
     "internalType": "string",
     "name": "",
     "type": "string"
    }
   ],
   "stateMutability": "view",
   "type": "function"
  },
  {
   "inputs": [
    {
     "internalType": "address",
     "name": "",
     "type": "address"
    }
   ],
   "name": "nonces",
   "outputs": [
    {
     "internalType": "uint256",
     "name": "",
     "type": "uint256"
    }
   ],
   "stateMutability": "view",
   "type": "function"
  },
  {
   "inputs": [
    {
     "internalType": "address",
     "name": "owner",
     "type": "address"
    },
    {
     "internalType": "address",
     "name": "spender",
     "type": "address"
    },
    {
     "internalType": "uint256",
     "name": "value",
     "type": "uint256"
    },
    {
     "internalType": "uint256",
     "name": "deadline",
     "type": "uint256"
    },
    {
     "internalType": "uint8",
     "name": "v",
     "type": "uint8"
    },
    {
     "internalType": "bytes32",
     "name": "r",
     "type": "bytes32"
    },
    {
     "internalType": "bytes32",
     "name": "s",
     "type": "bytes32"
    }
   ],
   "name": "permit",
   "outputs": [],
   "stateMutability": "nonpayable",
   "type": "function"
  },
  {
   "inputs": [],
   "name": "symbol",
   "outputs": [
    {
     "internalType": "string",
     "name": "",
     "type": "string"
    }
   ],
   "stateMutability": "view",
   "type": "function"
  },
  {
   "inputs": [],
   "name": "totalSupply",
   "outputs": [
    {
     "internalType": "uint256",
     "name": "",
     "type": "uint256"
    }
   ],
   "stateMutability": "view",
   "type": "function"
  },
  {
   "inputs": [
    {
     "internalType": "address",
     "name": "to",
     "type": "address"
    },
    {
     "internalType": "uint256",
     "name": "amount",
     "type": "uint256"
    }
   ],
   "name": "transfer",
   "outputs": [
    {
     "internalType": "bool",
     "name": "",
     "type": "bool"
    }
   ],
   "stateMutability": "nonpayable",
   "type": "function"
  },
  {
   "inputs": [
    {
     "internalType": "address",
     "name": "from",
     "type": "address"
    },
    {
     "internalType": "address",
     "name": "to",
     "type": "address"
    },
    {
     "internalType": "uint256",
     "name": "amount",
     "type": "uint256"
    }
   ],
   "name": "transferFrom",
   "outputs": [
    {
     "internalType": "bool",
     "name": "",
     "type": "bool"
    }
   ],
   "stateMutability": "nonpayable",
   "type": "function"
  },
  {
   "anonymous": false,
   "inputs": [
    {
     "indexed": true,
     "internalType": "address",
     "name": "owner",
     "type": "address"
    },
    {
     "indexed": true,
     "internalType": "address",
     "name": "spender",
     "type": "address"
    },
    {
     "indexed": false,
     "internalType": "uint256",
     "name": "amount",
     "type": "uint256"
    }
   ],
   "name": "Approval",
   "type": "event"
  },
  {
   "anonymous": false,
   "inputs": [
    {
     "indexed": true,
     "internalType": "address",
     "name": "from",
     "type": "address"
    },
    {
     "indexed": true,
     "internalType": "address",
     "name": "to",
     "type": "address"
    },
    {
     "indexed": false,
     "internalType": "uint256",
     "name": "amount",
     "type": "uint256"
    }
   ],
   "name": "Transfer",
   "type": "event"
  },
  {
   "inputs": [
    {
     "internalType": "address",
     "name": "owner",
     "type": "address"
    },
    {
     "internalType": "address",
     "name": "spender",
     "type": "address"
    },
    {
     "internalType": "uint256",
     "name": "allowance",
     "type": "uint256"
    },
    {
     "internalType": "uint256",
     "name": "amount",
     "type": "uint256"
    }
   ],
   "name": "InsufficientAllowance",
   "type": "error"
  },
  {
   "inputs": [
    {
     "internalType": "address",
     "name": "from",
     "type": "address"
    },
    {
     "internalType": "uint256",
     "name": "balance",
     "type": "uint256"
    },
    {
     "internalType": "uint256",
     "name": "amount",
     "type": "uint256"
    }
   ],
   "name": "InsufficientBalance",
   "type": "error"
  },
  {
   "inputs": [
    {
     "internalType": "uint256",
     "name": "currentSupply",
     "type": "uint256"
    },
    {
     "internalType": "uint256",
     "name": "amount",
     "type": "uint256"
    }
   ],
   "name": "MintOverflow",
   "type": "error"
  }
 ],
 "author": "0kn0t <0xknot@proton.me>",